lines/c03/c03-000f/c03-000f-05.png|Miss Delaney of the script , and the great
lines/c03/c03-000f/c03-000f-06.png|advantages to be derived from this unity
lines/c03/c03-000f/c03-000f-07.png|of conception and control are everywhere
lines/c03/c03-000f/c03-000f-08.png|apparent .
lines/c03/c03-003a/c03-003a-00.png|This is not a filmed play . It has been
lines/c03/c03-003a/c03-003a-01.png|conceived throughout in terms of the cinema ,
lines/c03/c03-003a/c03-003a-02.png|and again and again it is the visual qualities
lines/c03/c03-003a/c03-003a-03.png|of the story , and the marriage of the central
lines/c03/c03-003a/c03-003a-05.png|the film so vividly to life . In Fanny , which
lines/c03/c03-003a/c03-003a-07.png|Mr. Joshua Logan , attempted but failed to create
lines/c03/c03-003a/c03-003a-08.png|the atmosphere of a city .
lines/c03/c03-003b/c03-003b-00.png|This is not a filmed play . It has been conceived
lines/c03/c03-003b/c03-003b-02.png|again it is the visual qualities of the story , and
lines/c03/c03-003b/c03-003b-03.png|the marriage of the central characters to their
lines/c03/c03-003b/c03-003b-04.png|background , which bring the film so vividly to life .
lines/c03/c03-003b/c03-003b-05.png|In Fanny , which also has its premiere tomorrow ,
lines/c03/c03-003b/c03-003b-06.png|the director , Mr. Joshua Logan , attempted but failed
lines/c03/c03-003b/c03-003b-07.png|to create the atmosphere of a city .
lines/c03/c03-007/c03-007-00.png|In A Taste of Honey Mr. Richardson has taken
lines/c03/c03-007/c03-007-01.png|a town in the industrial North of England
lines/c03/c03-007/c03-007-02.png|and has made it live . The shabby streets
lines/c03/c03-007/c03-007-03.png|and wet pavements , the school play-grounds ,
lines/c03/c03-007/c03-007-04.png|the public monuments and the rubbish
lines/c03/c03-007/c03-007-05.png|strewn canals - even the worn head-stones
lines/c03/c03-007/c03-007-06.png|in the churchyard ,  sacred to the memory of  -
lines/c03/c03-003c/c03-003c-00.png|This is not a filmed play . It has been con-
lines/c03/c03-003c/c03-003c-01.png|ceived throughout in terms of the cinema , and
lines/c03/c03-003c/c03-003c-02.png|again and again it is the visual qualities of
lines/c03/c03-003c/c03-003c-03.png|the story , and the marriage of the central
lines/c03/c03-003c/c03-003c-04.png|characters to their background , which bring the
lines/c03/c03-003c/c03-003c-05.png|film so vividly to life . In Fanny , which also
lines/c03/c03-003c/c03-003c-06.png|has its premiere tomorrow , the director , Mr.
lines/c03/c03-003c/c03-003c-07.png|Joshua Logan , attempted but failed to
lines/c03/c03-003c/c03-003c-08.png|create the atmosphere of a city .
lines/c03/c03-003d/c03-003d-00.png|This is not a filmed play . It has been conceived
lines/c03/c03-003d/c03-003d-01.png|throughout in terms of the cinema , and again
lines/c03/c03-003d/c03-003d-02.png|and again it is the visual qualities of the
lines/c03/c03-003d/c03-003d-03.png|story , and the marriage of the central charac-
lines/c03/c03-003d/c03-003d-04.png|ters to their background , which bring the
lines/c03/c03-003d/c03-003d-05.png|film so vividly to life . In Fanny , which
lines/c03/c03-003d/c03-003d-06.png|also has its premiere tomorrow , the director ,
lines/c03/c03-003d/c03-003d-08.png|create the atmosphere of a city .
lines/c03/c03-003e/c03-003e-00.png|This is not a filmed play . It has been con-
lines/c03/c03-003e/c03-003e-01.png|ceived throughout in terms of the cinema ,
lines/c03/c03-003e/c03-003e-02.png|and again and again it is the visual qualities
lines/c03/c03-003e/c03-003e-03.png|of the story , and the marriage of the central
lines/c03/c03-003e/c03-003e-04.png|characters to their background , which bring
lines/c03/c03-003e/c03-003e-06.png|also has its premiere tomorrow , the director ,
lines/c03/c03-003e/c03-003e-07.png|Mr. Joshua Logan , attempted but failed to
lines/c03/c03-003e/c03-003e-08.png|create the atmosphere of a city .
lines/c03/c03-003f/c03-003f-00.png|This is not a filmed play . It has been concei-
lines/c03/c03-003f/c03-003f-01.png|ved throughout in terms of the cinema ,
lines/c03/c03-003f/c03-003f-02.png|and again and again it is the visual qualities
lines/c03/c03-003f/c03-003f-03.png|of the story , and the marriage of the
lines/c03/c03-003f/c03-003f-04.png|central characters to their background ,
lines/c03/c03-003f/c03-003f-05.png|which bring the film so vividly to life . In
lines/c03/c03-003f/c03-003f-08.png|but failed to create the atmosphere of
lines/c03/c03-003f/c03-003f-09.png|a city .
lines/c03/c03-007a/c03-007a-00.png|In A Taste of Honey Mr. Richardson has
lines/c03/c03-007a/c03-007a-01.png|taken a town in the industrial North of England
lines/c03/c03-007a/c03-007a-02.png|and has made it live . The shabby streets and
lines/c03/c03-007a/c03-007a-03.png|wet pavements , the school play-grounds , the
lines/c03/c03-007a/c03-007a-04.png|public monuments and the rubbish strewn canals -
lines/c03/c03-007a/c03-007a-05.png|even the worn head-stones in the churchyard ,
lines/c03/c03-007a/c03-007a-06.png| sacred to the memory of  - are seen as an
lines/c03/c03-007a/c03-007a-07.png|integral part of the story .
lines/c03/c03-007b/c03-007b-00.png|In A Taste of Honey Mr. Richardson has taken a
lines/c03/c03-007b/c03-007b-02.png|has made it live . The shabby streets and wet pavements ,
lines/c03/c03-007b/c03-007b-03.png|the school play-grounds , the public monuments and
lines/c03/c03-007b/c03-007b-04.png|the rubbish strewn canals - even the worn
lines/c03/c03-007b/c03-007b-05.png|head-stones in the churchyard ,  sacred to the
lines/c03/c03-007b/c03-007b-06.png|memory of  - are seen as an integral part of
lines/c03/c03-007b/c03-007b-07.png|the story .
lines/c03/c03-007c/c03-007c-00.png|In A Taste of Honey Mr. Richardson has taken
lines/c03/c03-007c/c03-007c-01.png|a town in the industrial North of England
lines/c03/c03-007c/c03-007c-02.png|and has made it live . The shabby streets
lines/c03/c03-007c/c03-007c-03.png|and wet pavements , the school play-grounds ,
lines/c03/c03-007c/c03-007c-05.png|canals - even the worn head-stones in the
lines/c03/c03-007c/c03-007c-06.png|churchyard ,  sacred to the memory of 
lines/c03/c03-007c/c03-007c-07.png|- are seen as an integral part of the
lines/c03/c03-007d/c03-007d-00.png|In A Taste of Honey Mr. Richardson has
lines/c03/c03-007d/c03-007d-01.png|taken a town in the industrial North of
lines/c03/c03-007d/c03-007d-02.png|England and has made it live . The shabby
lines/c03/c03-007d/c03-007d-03.png|streets and wet pavements , the school
lines/c03/c03-007d/c03-007d-04.png|play-grounds , the public monuments and
lines/c03/c03-007d/c03-007d-05.png|the rubbish strewn canals - even the
lines/c03/c03-007d/c03-007d-06.png|worn head-stones in the churchyard ,  sacred
lines/c03/c03-007d/c03-007d-07.png|to the memory of  - are seen as an
lines/c03/c03-007d/c03-007d-08.png|integral part of the story .
lines/c03/c03-007e/c03-007e-00.png|In A Taste of Honey Mr. Richardson has
lines/c03/c03-007e/c03-007e-01.png|taken a town in the industrial North of
lines/c03/c03-007e/c03-007e-02.png|England and has made it live . The shabby
lines/c03/c03-007e/c03-007e-03.png|streets and wet pavements , the school play-
lines/c03/c03-007e/c03-007e-04.png|grounds , the public monuments and the
lines/c03/c03-007e/c03-007e-05.png|rubbish strewn canals - even the worn
lines/c03/c03-007e/c03-007e-06.png|head-stones in the churchyard ,  sacred to
lines/c03/c03-007e/c03-007e-07.png|the memory of  - are seen as an integral
lines/c03/c03-007e/c03-007e-08.png|part of the story .
lines/c03/c03-007f/c03-007f-00.png|In A Taste of Honey Mr. Richardson has
lines/c03/c03-007f/c03-007f-01.png|taken a town in the industrial North of
lines/c03/c03-007f/c03-007f-02.png|England and has made it live . The shabby
lines/c03/c03-007f/c03-007f-03.png|streets and wet pavements , the school
lines/c03/c03-007f/c03-007f-04.png|play-grounds , the public monuments and
lines/c03/c03-007f/c03-007f-05.png|the rubbish strewn canals - even the worn
lines/c03/c03-007f/c03-007f-06.png|head-stones in the churchyard ,  sacred to
lines/c03/c03-007f/c03-007f-07.png|the memory of  - are seen as an inte-
lines/c03/c03-007f/c03-007f-08.png|gral part of the story .
lines/c03/c03-016a/c03-016a-00.png|But there is heart in the telling , and an
lines/c03/c03-016a/c03-016a-01.png|intense realism in the situation . A young
lines/c03/c03-016a/c03-016a-02.png|girl lives in a single dingy room with
lines/c03/c03-016a/c03-016a-03.png|her slatternly , promiscuous mother . In such
lines/c03/c03-016a/c03-016a-04.png|surroundings she learns sex is something
lines/c03/c03-016a/c03-016a-05.png|sordid , and when she experiences it for the
lines/c03/c03-016a/c03-016a-06.png|first time herself it is incoherently , clumsily ,
lines/c03/c03-016a/c03-016a-07.png|but half inquisitively . As is the case in Fanny
lines/c03/c03-016a/c03-016a-08.png|her first lover is a sailor who leaves her
lines/c03/c03-016a/c03-016a-09.png|to bear his child and sails away .
lines/c03/c03-016b/c03-016b-01.png|realism in the situation . A young girl lives in
lines/c03/c03-016b/c03-016b-03.png|promiscuous mother . In such surroundings she
lines/c03/c03-016b/c03-016b-04.png|learns sex is something sordid , and when she
lines/c03/c03-016b/c03-016b-06.png|is incoherently , clumsily , but half shyly and
lines/c03/c03-016b/c03-016b-07.png|half inquisitively . As is the case in Fanny her
lines/c03/c03-016b/c03-016b-08.png|first lover is a sailor who leaves her to bear
lines/c03/c03-016b/c03-016b-09.png|his child and sails away .
lines/c03/c03-016c/c03-016c-00.png|But there is heart in the telling , and an
lines/c03/c03-016c/c03-016c-01.png|intense realism in the situation . A young
lines/c03/c03-016c/c03-016c-02.png|girl lives in a single dingy room with her
lines/c03/c03-016c/c03-016c-04.png|surroundings she learns sex is something sordid ,
lines/c03/c03-016c/c03-016c-06.png|herself it is incoherently , clumsily , but half
lines/c03/c03-016c/c03-016c-08.png|Fanny her first lover is a sailor who leaves
lines/c03/c03-016c/c03-016c-09.png|her to bear his child and sails away .
lines/c03/c03-016d/c03-016d-00.png|But there is heart in the telling , and an
lines/c03/c03-016d/c03-016d-01.png|intense realism in the situation . A young
lines/c03/c03-016d/c03-016d-02.png|girl lives in a single dingy room with
lines/c03/c03-016d/c03-016d-03.png|her slatternly , promiscuous mother . In such
lines/c03/c03-016d/c03-016d-04.png|surroundings she learns sex is something
lines/c03/c03-016d/c03-016d-05.png|sordid , and when she experiences it for
lines/c03/c03-016d/c03-016d-06.png|the first time herself it is incoherently , clumsily ,
lines/c03/c03-016d/c03-016d-08.png|is the case in Fanny her first lover is a sailor
lines/c03/c03-016d/c03-016d-09.png|who leaves her to bear his child and sails
lines/c03/c03-016d/c03-016d-10.png|away .
lines/c03/c03-016e/c03-016e-00.png|But there is heart in the telling , and an
lines/c03/c03-016e/c03-016e-01.png|intense realism in the situation . A young
lines/c03/c03-016e/c03-016e-02.png|girl lives in a single dingy room with her
lines/c03/c03-016e/c03-016e-04.png|surroundings she learns sex is something
lines/c03/c03-016e/c03-016e-05.png|sordid , and when she experiences it for the
lines/c03/c03-016e/c03-016e-06.png|first time herself it is incoherently ,
lines/c03/c03-016e/c03-016e-07.png|clumsily , but half shyly and half in-
lines/c03/c03-016e/c03-016e-08.png|quisitively . As is the case in Fanny her
lines/c03/c03-016e/c03-016e-09.png|first lover is a sailor who leaves her to
lines/c03/c03-016e/c03-016e-10.png|bear his child and sails away .
lines/c03/c03-021a/c03-021a-00.png|In Fanny the pregnant girl is befriended by
lines/c03/c03-021a/c03-021a-02.png|estranged from women but yet moved by a
lines/c03/c03-021a/c03-021a-03.png|strong maternal instinct to the unborn child
lines/c03/c03-021a/c03-021a-04.png|as much as to the expectant mother , who acts
lines/c03/c03-021a/c03-021a-05.png|as a protector and comforter to her in her
lines/c03/c03-021a/c03-021a-06.png|hour of need . He shares her room and gives
lines/c03/c03-021a/c03-021a-07.png|her his forlorn gift of companionship and sym-
lines/c03/c03-021a/c03-021a-08.png|pathy -  you need someone to love you while
lines/c03/c03-021a/c03-021a-09.png|you are looking for someone to love  .
lines/c03/c03-021b/c03-021b-00.png|In Fanny the pregnant girl is befriended by an old
lines/c03/c03-021b/c03-021b-02.png|women but yet moved by a strong maternal instinct to
lines/c03/c03-021b/c03-021b-04.png|who acts as a protector and comforter to her in her hour
lines/c03/c03-021b/c03-021b-05.png|of need . He shares her room and gives her his forlorn
lines/c03/c03-021b/c03-021b-06.png|gift of companionship and sympathy -  you need
lines/c03/c03-021b/c03-021b-07.png|someone to love you while you are looking for
lines/c03/c03-021c/c03-021c-00.png|In Fanny the pregnant girl is befriended by an
lines/c03/c03-021c/c03-021c-01.png|old man . Here it is a young homosexual , estranged
lines/c03/c03-021c/c03-021c-02.png|from women but yet moved by a strong maternal
lines/c03/c03-021c/c03-021c-03.png|instinct to the unborn child as much as to the
lines/c03/c03-021c/c03-021c-04.png|expectant mother , who acts as a protector and
lines/c03/c03-021c/c03-021c-06.png|shares her room and gives her his forlorn gift
lines/c03/c03-021c/c03-021c-07.png|of companionship and sympathy -  you need someone
lines/c03/c03-021c/c03-021c-08.png|to love you while you are looking for
lines/c03/c03-021c/c03-021c-09.png|someone to love  .
lines/c03/c03-021d/c03-021d-00.png|In Fanny the pregnant girl is befriended by
lines/c03/c03-021d/c03-021d-01.png|an old man . Here it is a young homosexual ,
lines/c03/c03-021d/c03-021d-02.png|estranged from women but yet moved by a
lines/c03/c03-021d/c03-021d-03.png|strong maternal instinct to the unborn child
lines/c03/c03-021d/c03-021d-04.png|as much as to the expectant mother , who
lines/c03/c03-021d/c03-021d-05.png|acts as a protector and comforter to her in
lines/c03/c03-021d/c03-021d-06.png|her hour of need . He shares her room and gives
lines/c03/c03-021d/c03-021d-07.png|her his forlorn gift of companionship and
lines/c03/c03-021d/c03-021d-08.png|sympathy -  you need someone to love you while
lines/c03/c03-021d/c03-021d-09.png|you are looking for someone to love  .
lines/c03/c03-021e/c03-021e-00.png|In Fanny the pregnant girl is befriended
lines/c03/c03-021e/c03-021e-01.png|by an old man . Here it is a young homo-
lines/c03/c03-021e/c03-021e-02.png|sexual , estranged from women but yet moved
lines/c03/c03-021e/c03-021e-03.png|by a strong maternal instinct to the unborn
lines/c03/c03-021e/c03-021e-04.png|child as much as to the expectant mother ,
lines/c03/c03-021e/c03-021e-05.png|who acts as a protector and comforter to
lines/c03/c03-021e/c03-021e-06.png|her in her hour of need . He shares her room
lines/c03/c03-021e/c03-021e-07.png|and gives her his forlorn gift of com-
lines/c03/c03-021e/c03-021e-08.png|panionship and sympathy -  you need someone
lines/c03/c03-021e/c03-021e-09.png|to love you while you are looking for
lines/c03/c03-021f/c03-021f-00.png|In Fanny the pregnant girl is befriended
lines/c03/c03-021f/c03-021f-02.png|sexual , estranged from women but yet
lines/c03/c03-021f/c03-021f-03.png|moved by a strong maternal instinct to
lines/c03/c03-021f/c03-021f-04.png|the unborn child as much as to the
lines/c03/c03-021f/c03-021f-06.png|and comforter to her in her hour of need .
lines/c03/c03-021f/c03-021f-07.png|He shares her room and gives her his
lines/c03/c03-021f/c03-021f-08.png|forlorn gift of companionship and sympathy -
lines/c03/c03-081a/c03-081a-00.png|Arguably , the dramatist has committed a
lines/c03/c03-081a/c03-081a-01.png|technical error in allowing Irene to speak
lines/c03/c03-081a/c03-081a-02.png|for herself ; we would be altogether clearer
lines/c03/c03-081a/c03-081a-03.png|in our minds about her if she remained
lines/c03/c03-081a/c03-081a-04.png|a flawed but beautiful enigma , seen but not
lines/c03/c03-081a/c03-081a-05.png|heard . However , Miss Pinkie Johnstone makes her
lines/c03/c03-081a/c03-081a-06.png|few brief scenes effective , and Mr. Dinsdale
lines/c03/c03-081a/c03-081a-07.png|Landen , in the longest and most exacting role ,
lines/c03/c03-081a/c03-081a-08.png|that of the sergeant , gives a performance of
lines/c03/c03-081a/c03-081a-09.png|rare intelligence and restrained power .
lines/c03/c03-081b/c03-081b-00.png|Arguably , the dramatist has committed a
lines/c03/c03-081b/c03-081b-01.png|technical error in allowing Irene to speak for
lines/c03/c03-081b/c03-081b-02.png|herself ; we would be altogether clearer in our
lines/c03/c03-081b/c03-081b-03.png|minds about her if she remained a flawed but
lines/c03/c03-081b/c03-081b-04.png|beautiful enigma , seen but not heard . However ,
lines/c03/c03-081b/c03-081b-05.png|Miss Pinkie Johnstone makes her few brief scenes
lines/c03/c03-081b/c03-081b-07.png|the longest and most exacting role , that of the
lines/c03/c03-081b/c03-081b-08.png|sergeant , gives a performance of rare intelligence
lines/c03/c03-081b/c03-081b-09.png|and restrained power .
lines/c03/c03-081c/c03-081c-00.png|Arguably , the dramatist has committed a technical
lines/c03/c03-081c/c03-081c-01.png|error in allowing Irene to speak for herself ;
lines/c03/c03-081c/c03-081c-02.png|we would be altogether clearer in our minds
lines/c03/c03-081c/c03-081c-03.png|about her if she remained a flawed but beautiful
lines/c03/c03-081c/c03-081c-04.png|enigma , seen but not heard . However , Miss Pinkie
lines/c03/c03-081c/c03-081c-05.png|Johnstone makes her few brief scenes effective , and
lines/c03/c03-081c/c03-081c-06.png|Mr. Dinsdale Landen , in the longest and most
lines/c03/c03-081c/c03-081c-08.png|of rare intelligence and restrained power .
lines/c03/c03-081d/c03-081d-00.png|Arguably , the dramatist has committed a
lines/c03/c03-081d/c03-081d-01.png|technical error in allowing Irene to speak
lines/c03/c03-081d/c03-081d-02.png|for herself ; we would be altogether clearer
lines/c03/c03-081d/c03-081d-03.png|in our minds about her if she remained
lines/c03/c03-081d/c03-081d-04.png|a flawed but beautiful enigma , seen but
lines/c03/c03-081d/c03-081d-05.png|not heard . However , Miss Pinkie Johnstone
lines/c03/c03-081d/c03-081d-06.png|makes her few brief scenes effective , and Mr.
lines/c03/c03-081d/c03-081d-07.png|Dinsdale Landen , in the longest and most
lines/c03/c03-081d/c03-081d-08.png|exacting role , that of the sergeant , gives
lines/c03/c03-081d/c03-081d-09.png|a performance of rare intelligence and
lines/c03/c03-081d/c03-081d-10.png|restrained power .
lines/c03/c03-081e/c03-081e-00.png|Arguably , the dramatist has committed a
lines/c03/c03-081e/c03-081e-01.png|technical error in allowing Irene to speak
lines/c03/c03-081e/c03-081e-02.png|for herself ; we would be altogether clearer
lines/c03/c03-081e/c03-081e-03.png|in our minds about her if she remained
lines/c03/c03-081e/c03-081e-04.png|a flawed but beautiful enigma , seen but
lines/c03/c03-081e/c03-081e-05.png|not heard . However , Miss Pinkie Johnstone
lines/c03/c03-081e/c03-081e-06.png|makes her few brief scenes effective , and
lines/c03/c03-081e/c03-081e-07.png|Mr. Dinsdale Landen , in the longest and most
lines/c03/c03-081e/c03-081e-09.png|mance of rare intelligence and restrained
lines/c03/c03-081e/c03-081e-10.png|power .
lines/c03/c03-081f/c03-081f-00.png|Arguably , the dramatist has committed a
lines/c03/c03-081f/c03-081f-01.png|technical error in allowing Irene to speak
lines/c03/c03-081f/c03-081f-02.png|for herself ; we would be altogether clearer
lines/c03/c03-081f/c03-081f-03.png|in our minds about her if she remained a
lines/c03/c03-081f/c03-081f-04.png|flawed but beautiful enigma , seen but not
lines/c03/c03-081f/c03-081f-05.png|heard . However , Miss Pinkie Johnstone
lines/c03/c03-081f/c03-081f-06.png|makes her few brief scenes effective , and
lines/c03/c03-081f/c03-081f-07.png|Mr. Dinsdale Landen , in the longest and most
lines/c03/c03-081f/c03-081f-09.png|performance of rare intelligence and restrained
lines/c03/c03-084a/c03-084a-00.png|Mr. Bryan Stonehouse's production is quietly
lines/c03/c03-084a/c03-084a-01.png|effective , giving full value to the formal elements
lines/c03/c03-084a/c03-084a-02.png|of Betti's writing without over-emphasizing
lines/c03/c03-084a/c03-084a-03.png|them . Last night's play in the  Play of the
lines/c03/c03-084a/c03-084a-04.png|Week  series on independent television , Then
lines/c03/c03-084a/c03-084a-05.png|We Fall , by Mr. Paul Ferris , was a morality
lines/c03/c03-084a/c03-084a-06.png|on the not unfamiliar theme of the destructive
lines/c03/c03-084a/c03-084a-07.png|power of unbridled ambition .
lines/c03/c03-084b/c03-084b-00.png|Mr. Bryan Stonehouse's production is quietly
lines/c03/c03-084b/c03-084b-03.png|them . Last night's play in the  Play of the
lines/c03/c03-084b/c03-084b-06.png|on the not unfamiliar theme of the destructive
lines/c03/c03-084b/c03-084b-07.png|power of unbridled ambition .
lines/c03/c03-084c/c03-084c-00.png|Mr. Bryan Stonehouse's production is quietly effective ,
lines/c03/c03-084c/c03-084c-05.png|was a morality on the not unfamiliar theme of
lines/c03/c03-084c/c03-084c-06.png|the destructive power of unbridled ambition .
lines/c03/c03-084d/c03-084d-00.png|Mr. Bryan Stonehouse's production is quietly
lines/c03/c03-084d/c03-084d-01.png|effective , giving full value to the formal
lines/c03/c03-084d/c03-084d-02.png|elements of Betti's writing without over-
lines/c03/c03-084d/c03-084d-03.png|emphasizing them . Last night's play in the
lines/c03/c03-084d/c03-084d-04.png| Play of the Week  series on independent
lines/c03/c03-084d/c03-084d-05.png|television , Then We Fall , by Mr. Paul Fer-
lines/c03/c03-084d/c03-084d-06.png|ris , was a morality on the not unfamiliar
lines/c03/c03-084d/c03-084d-07.png|theme of the destructive power of unbridled
lines/c03/c03-084d/c03-084d-08.png|ambition .
lines/c03/c03-084e/c03-084e-00.png|Mr. Bryan Stonehouse's production is quietly
lines/c03/c03-084e/c03-084e-01.png|effective , giving full value to the formal elements
lines/c03/c03-084e/c03-084e-02.png|of Betti's writing without over-emphasizing
lines/c03/c03-084e/c03-084e-03.png|them . Last night's play in the  Play of the
lines/c03/c03-084e/c03-084e-05.png|Fall , by Mr. Paul Ferris , was a morality on
lines/c03/c03-084e/c03-084e-06.png|the not unfamiliar theme of the destructive
lines/c03/c03-084e/c03-084e-07.png|power of unbridled ambition .
lines/c03/c03-084f/c03-084f-00.png|Mr. Bryan Stonehouse's production is
lines/c03/c03-084f/c03-084f-02.png|formal elements of Betti's writing without
lines/c03/c03-084f/c03-084f-03.png|over-emphasizing them . Last night's play
lines/c03/c03-084f/c03-084f-04.png|in the  Play of the Week  series on
lines/c03/c03-084f/c03-084f-05.png|independent television , Then We Fall , by
lines/c03/c03-084f/c03-084f-07.png|unfamiliar theme of the destructive power
lines/c03/c03-084f/c03-084f-08.png|of unbridled ambition .
lines/c03/c03-087a/c03-087a-00.png|It went , perhaps , some distance beyond most
lines/c03/c03-087a/c03-087a-01.png|treatments of its subject by attempting to
lines/c03/c03-087a/c03-087a-02.png|generate a melodramatic inevitability which
lines/c03/c03-087a/c03-087a-03.png|left its central character and the world
lines/c03/c03-087a/c03-087a-04.png|around him in complete , unredeemable desolation .
lines/c03/c03-087a/c03-087a-05.png|We could , perhaps , say whether or not the attempt
lines/c03/c03-087a/c03-087a-06.png|succeeded if we had a little more faith in the
lines/c03/c03-087a/c03-087a-08.png|characters .
lines/c03/c03-087b/c03-087b-00.png|It went , perhaps , some distance beyond most
lines/c03/c03-087b/c03-087b-01.png|treatments of its subject by attempting to
lines/c03/c03-087b/c03-087b-02.png|generate a melodramatic inevitability which
lines/c03/c03-087b/c03-087b-03.png|left its central character and the world
lines/c03/c03-087b/c03-087b-04.png|around him in complete , unredeemable desolation .
lines/c03/c03-087b/c03-087b-05.png|We could , perhaps , say whether or not the attempt
lines/c03/c03-087b/c03-087b-08.png|his characters .
lines/c03/c03-087c/c03-087c-00.png|It went , perhaps , some distance beyond most treatments
lines/c03/c03-087c/c03-087c-01.png|of its subject by attempting to generate a melo-
lines/c03/c03-087c/c03-087c-02.png|dramatic inevitability which left its central character
lines/c03/c03-087c/c03-087c-03.png|and the world around him in complete , unredee-
lines/c03/c03-087c/c03-087c-04.png|mable desolation . We could , perhaps , say whether
lines/c03/c03-087c/c03-087c-05.png|or not the attempt succeeded if we had a
lines/c03/c03-087c/c03-087c-06.png|little more faith in the way in which Mr.
lines/c03/c03-087d/c03-087d-00.png|It went , perhaps , some distance beyond
lines/c03/c03-087d/c03-087d-01.png|most treatments of its subject by
lines/c03/c03-087d/c03-087d-02.png|attempting to generate a melodramatic
lines/c03/c03-087d/c03-087d-03.png|inevitability which left its central character
lines/c03/c03-087d/c03-087d-04.png|and the world around him in complete ,
lines/c03/c03-087d/c03-087d-05.png|unredeemable desolation . We could , perhaps ,
lines/c03/c03-087d/c03-087d-06.png|say whether or not the attempt succeeded
lines/c03/c03-087d/c03-087d-07.png|of we had a little more faith in the
lines/c03/c03-087d/c03-087d-08.png|way in which Mr. Ferris manipulated
lines/c03/c03-087d/c03-087d-09.png|his characters .
lines/c03/c03-087e/c03-087e-00.png|It went , perhaps , some distance beyond most
lines/c03/c03-087e/c03-087e-01.png|treatments of its subject by attempting to
lines/c03/c03-087e/c03-087e-02.png|generate a melodramatic inevitability
lines/c03/c03-087e/c03-087e-03.png|which left its central character and the world
lines/c03/c03-087e/c03-087e-04.png|around him in complete , unredeemable de-
lines/c03/c03-087e/c03-087e-05.png|solation . We could , perhaps , say whether or not
