lines/f07/f07-084a/f07-084a-07.png|a noble dish is , A sort of soup , or
lines/f07/f07-084a/f07-084a-08.png|broth , or brew , A hotch-potch of all
lines/f07/f07-084a/f07-084a-09.png|sorts of fishes That Greenwich never
lines/f07/f07-084a/f07-084a-10.png|could outdo ; Green herbs , red peppers ,
lines/f07/f07-084b/f07-084b-01.png|in France as is tea drinking among ourselves and it is
lines/f07/f07-084b/f07-084b-02.png|prepared at least once a week in every bourgeois
lines/f07/f07-084b/f07-084b-03.png|household . Thackeray , of course , waxed enthusiastic
lines/f07/f07-084b/f07-084b-04.png|about Bouillabaisse and sang - This Bouillabaisse a
lines/f07/f07-084b/f07-084b-05.png|noble dish is , A sort of soup , or broth , or brew ,
lines/f07/f07-084b/f07-084b-06.png|A hotch-potch of all sorts of fishes That Greenwich
lines/f07/f07-084b/f07-084b-07.png|never could outdo ; Green herbs , red peppers , mussels ,
lines/f07/f07-084b/f07-084b-08.png|saffron , Soles , onions , garlic , roach and dace .
lines/f07/f07-088a/f07-088a-00.png|A fascinating study also opens up in
lines/f07/f07-088a/f07-088a-01.png|the dietary welcomed by men of genius
lines/f07/f07-088a/f07-088a-02.png|as well as the foods for which they have
lines/f07/f07-088a/f07-088a-03.png|had an aversion . Shelley , for example ,
lines/f07/f07-088a/f07-088a-04.png|had a great contempt for animal
lines/f07/f07-088a/f07-088a-05.png|food , believing that it impaired the
lines/f07/f07-088a/f07-088a-07.png|fast and supper consisted of a
lines/f07/f07-088a/f07-088a-08.png|piece of coarse bread and a
lines/f07/f07-088a/f07-088a-09.png|bowl of milk .
lines/f07/f07-088b/f07-088b-00.png|A fascinating study also opens up in the dietary
lines/f07/f07-088b/f07-088b-01.png|welcomed by men of genius as well as the foods for
lines/f07/f07-088b/f07-088b-02.png|which they have had an aversion . Shelley , for example ,
lines/f07/f07-088b/f07-088b-03.png|had a great contempt for animal food , believing that
lines/f07/f07-088b/f07-088b-04.png|it # impaired the intellectual faculties . Bunyan's
lines/f07/f07-088b/f07-088b-05.png|breakfast and supper consisted of a piece of coarse bread
lines/f07/f07-088b/f07-088b-06.png|and a bowl of milk .
lines/f07/f07-092a/f07-092a-00.png|Dante Gabriel Rossetti had simple tastes
lines/f07/f07-092a/f07-092a-01.png|in food . At one dinner he is said to have
lines/f07/f07-092a/f07-092a-02.png|been blind to the charms of turbot and
lines/f07/f07-092a/f07-092a-03.png|to have been much more interested
lines/f07/f07-092a/f07-092a-04.png|in the dish in which it was served . He
lines/f07/f07-092a/f07-092a-05.png|turned it over on the table cloth to
lines/f07/f07-092a/f07-092a-06.png|examine the marks on the back
lines/f07/f07-092a/f07-092a-07.png|without going through the formality
lines/f07/f07-092a/f07-092a-08.png|of having his turbot removed first .
lines/f07/f07-092b/f07-092b-00.png|Dante Gabriel Rossetti had simple tastes in food . At one
lines/f07/f07-092b/f07-092b-01.png|dinner he is said to have been blind to the charms of
lines/f07/f07-092b/f07-092b-02.png|turbot and to have been much more interested in the
lines/f07/f07-092b/f07-092b-04.png|on the table cloth to examine the marks on the back
lines/f07/f07-092b/f07-092b-05.png|without going through the formality of having his turbot
lines/f07/f07-092b/f07-092b-06.png|removed first .
lines/f07/f07-101a/f07-101a-00.png|THE SAME MAN WENT TO SEE CARLYLE , AND ,
lines/f07/f07-101a/f07-101a-01.png|AFTER MENTIONING THAT HE HAD DINED WITH
lines/f07/f07-101a/f07-101a-02.png|LONGFELLOW TOLD THE SAGE A VERY
lines/f07/f07-101a/f07-101a-03.png|FUNNY STORY WHICH MADE CARLYLE
lines/f07/f07-101a/f07-101a-04.png|ABSOLUTELY LAUGH ; BUT ALL THE
lines/f07/f07-101a/f07-101a-05.png|CHELSEA PHILOSOPHER DID IN RETURN
lines/f07/f07-101a/f07-101a-06.png|WAS TO ASK IF HIS GUEST WOULD
lines/f07/f07-101a/f07-101a-07.png|HAVE A CUP OF TEA !
lines/f07/f07-101b/f07-101b-00.png|The same man went to see Carlyle , and , after mentioning
lines/f07/f07-101b/f07-101b-01.png|that he had dined with Longfellow told the sage a
lines/f07/f07-101b/f07-101b-02.png|very funny story which made Carlyle absolutely laugh ;
lines/f07/f07-101b/f07-101b-03.png|but all the Chelsea philosopher did in return was to
lines/f07/f07-101b/f07-101b-04.png|ask if his guest would have a cup of tea !
lines/g01/g01-000/g01-000-00.png|A Scottish knight - Sir John Mercer - was
lines/g01/g01-000/g01-000-01.png|imprisoned in England . His son , in revenge , was
lines/g01/g01-000/g01-000-02.png|harrying English shipping as far away as Cherbourg ,
lines/g01/g01-000/g01-000-03.png|and doing it to some purpose . John Philpot ,
lines/g01/g01-000/g01-000-04.png|one of that new class of merchant financiers
lines/g01/g01-000/g01-000-05.png|which the city of London was now producing , fitted ,
lines/g01/g01-000/g01-000-06.png|equipped and manned a fleet from his own
lines/g01/g01-000/g01-000-07.png|resources , and captured the young Mercer in a
lines/g01/g01-000/g01-000-08.png|brilliant Channel fight .
lines/g01/g01-004/g01-004-00.png|It was naturally a highly popular victory with the
lines/g01/g01-004/g01-004-01.png|Londoners , but it brought heavy censure from nobles
lines/g01/g01-004/g01-004-02.png|who still believed that they had a monopoly of
lines/g01/g01-004/g01-004-03.png|leadership . But , at last , Gaunt sailed . Opposing
lines/g01/g01-004/g01-004-04.png|him was the French Admiral , Jean de Vienne -
lines/g01/g01-004/g01-004-05.png|a great sailor and an able strategist .
lines/g01/g01-008/g01-008-00.png|Obedient to the policy of his King , de Vienne avoided
lines/g01/g01-008/g01-008-01.png|trouble at sea as cleverly as Du Guesclin avoided it
lines/g01/g01-008/g01-008-02.png|on land . Gaunt was compelled to give up his search for
lines/g01/g01-008/g01-008-03.png|an elusive foe , and , afraid to return home without
lines/g01/g01-008/g01-008-04.png|something to show , he foolishly attempted to besiege
lines/g01/g01-008/g01-008-05.png|the well-protected fortress of St Malo . This
lines/g01/g01-008/g01-008-06.png|involved the dreary method of mining operations in
lines/g01/g01-008/g01-008-07.png|which Gaunt , under the Black Prince , had shown
lines/g01/g01-008/g01-008-08.png|considerable skill at the siege of Limoges .
lines/g01/g01-012/g01-012-00.png|When all seemed to be going well , a sortie surprised
lines/g01/g01-012/g01-012-01.png|moment had charge of the mine ; the mine collapsed
lines/g01/g01-012/g01-012-02.png|fame and glory . Gaunt was compelled to return
lines/g01/g01-012/g01-012-03.png|even despised failure . The ' ribald ' Londoners , who
lines/g01/g01-012/g01-012-04.png|Hawley , were also expressing their disappointment
lines/g01/g01-012/g01-012-05.png|comparing the failure of a subsidized duke
lines/g01/g01-012/g01-012-06.png|citizen .
lines/g01/g01-016/g01-016-00.png|These dreary years of ineffective fighting provide
lines/g01/g01-016/g01-016-01.png|obvious morals for those who are judges long
lines/g01/g01-016/g01-016-02.png|after the event . It seems obvious that , though
lines/g01/g01-016/g01-016-03.png|the longbows of yeomen could pierce the
lines/g01/g01-016/g01-016-04.png|plate and mail of French knights , a brilliant
lines/g01/g01-016/g01-016-05.png|battle was no substitute for a sound policy ,
lines/g01/g01-016/g01-016-06.png|and that , if archers had no target , campaigns
lines/g01/g01-016/g01-016-07.png|became mere marauding route marches .
lines/g01/g01-019/g01-019-00.png|It seems obvious that if an expedition to
lines/g01/g01-019/g01-019-01.png|Brittany was compelled to attack via Calais ,
lines/g01/g01-019/g01-019-02.png|then the primary essential to the success
lines/g01/g01-019/g01-019-04.png|command of the Channel . It seems obvious
lines/g01/g01-019/g01-019-05.png|that divided forces were dissipating the
lines/g01/g01-019/g01-019-06.png|advantages of a ring of bridge-heads which included
lines/g01/g01-019/g01-019-07.png|Calais , Cherbourg , Brest , Bordeaux and Bayonne ,
lines/g01/g01-019/g01-019-08.png|and that there was no hope of final victory
lines/g01/g01-019/g01-019-09.png|without a large-scale and concentrated invasion .
lines/g01/g01-022/g01-022-00.png|BUT NONE OF THESE DEDUCTIONS WERE
lines/g01/g01-022/g01-022-01.png|DRAWN AT THE TIME , BECAUSE LARGE-
lines/g01/g01-022/g01-022-02.png|SCALE WAR REQUIRED MONEY , AND
lines/g01/g01-022/g01-022-03.png|THE CITIZENS WHO HAD THE MONEY
lines/g01/g01-022/g01-022-04.png|WERE NOT YET SUFFICIENTLY AT
lines/g01/g01-022/g01-022-05.png|ONE WITH NOBLES AND KING TO THINK
lines/g01/g01-022/g01-022-06.png|THEIR MONEY WELL SPENT IN FIN-
lines/g01/g01-022/g01-022-07.png|ANCING A RULING CLASS WHICH
lines/g01/g01-022/g01-022-08.png|DESPISED THEM . THE COMMONS WERE
lines/g01/g01-022/g01-022-09.png|GLAD ENOUGH TO ENJOY THE FRUITS
lines/g01/g01-025/g01-025-00.png|In this cruel process which was
lines/g01/g01-025/g01-025-01.png|hammering out nations on the anvils of
lines/g01/g01-025/g01-025-02.png|war , there was a constant stirring of
lines/g01/g01-025/g01-025-03.png|those in authority to find some simple
lines/g01/g01-025/g01-025-04.png|way out of the complicated financial
lines/g01/g01-025/g01-025-05.png|6impasse which always resulted , and in the
lines/g01/g01-025/g01-025-06.png|story of the experiments and expedients
lines/g01/g01-025/g01-025-07.png|to which the Exchequer resorted is
lines/g01/g01-025/g01-025-08.png|the story of the prelude to the
lines/g01/g01-025/g01-025-09.png|Peasants' Revolt of 1381 .
lines/g01/g01-027/g01-027-00.png|In appreciating this story , modern con-
lines/g01/g01-027/g01-027-01.png|ceptions of governmental duties must be
lines/g01/g01-027/g01-027-02.png|set aside . A modern government needs
lines/g01/g01-027/g01-027-03.png|taxation not merely for defence and
lines/g01/g01-027/g01-027-04.png|offence but for a very wide range of
lines/g01/g01-027/g01-027-05.png|social services . A mediaeval oligarchy
lines/g01/g01-027/g01-027-06.png|needed taxation in order to supplement
lines/g01/g01-027/g01-027-07.png|the private wealth of the monarchy
lines/g01/g01-027/g01-027-09.png|crown lands , the fees of feudalism
lines/g01/g01-031/g01-031-00.png|Social service as a function of government
lines/g01/g01-031/g01-031-01.png|was quite alien to mediaeval thought - its
lines/g01/g01-031/g01-031-03.png|communities , whether those communities were
lines/g01/g01-031/g01-031-04.png|monasteries , manors , townships , or wards and
lines/g01/g01-031/g01-031-05.png|guilds of a city . A mediaeval tax was
lines/g01/g01-031/g01-031-06.png|therefore in essence a forced payment whose
lines/g01/g01-031/g01-031-07.png|return was the uncertain bounty of booty
lines/g01/g01-031/g01-031-08.png|and the vague advantages of military glory ;
lines/g01/g01-031/g01-031-09.png|it was therefore always granted grudgingly
lines/g01/g01-031/g01-031-10.png|and coupled with the vain hope that , in the
lines/g01/g01-034/g01-034-00.png|When ' his ' war did not bring victory and
lines/g01/g01-034/g01-034-01.png|booty , a new group of Lords might oust
lines/g01/g01-034/g01-034-02.png|the unsuccessful leaders , and the Commons ,
lines/g01/g01-034/g01-034-03.png|who usually supplied the hard cash , might
lines/g01/g01-034/g01-034-04.png|be bold enough to demand the production of
lines/g01/g01-034/g01-034-05.png|accounts , and even at times the impeachment of
lines/g01/g01-034/g01-034-06.png|the unsuccessful . But the Commons were not
lines/g01/g01-034/g01-034-07.png|the people , and even a full Parliament was
lines/g01/g01-034/g01-034-08.png|not yet a true mirror of the nation .
lines/g01/g01-037/g01-037-00.png|The people - Langland's ' folk ' and Gaunt's
lines/g01/g01-037/g01-037-01.png|' knaves ' - were villeins still tied to the
lines/g01/g01-037/g01-037-02.png|feudal obligations of work or villeins who
lines/g01/g01-037/g01-037-03.png|had bought their release , free labourers
lines/g01/g01-037/g01-037-04.png|who worked for the highest bidders , free
lines/g01/g01-037/g01-037-05.png|yeomen who had prospered enough to become
lines/g01/g01-037/g01-037-06.png|successful farmers , the artisans , craftsmen ,
lines/g01/g01-037/g01-037-07.png|journeymen and small tradesmen of the
lines/g01/g01-037/g01-037-08.png|towns , and the retainers and men-at-arms
lines/g01/g01-037/g01-037-09.png|in the pay of landed Lords .
lines/g01/g01-039/g01-039-00.png|None of these classes , except the yeomen , paid or
lines/g01/g01-039/g01-039-01.png|expected to pay direct taxes . During the four-
lines/g01/g01-039/g01-039-02.png|teenth century , the traditional methods of
lines/g01/g01-039/g01-039-03.png|financing the Exchequer had become stabilized .
lines/g01/g01-039/g01-039-04.png|When the King and his Council required additio-
lines/g01/g01-039/g01-039-05.png|nal funds , they were usually granted an
lines/g01/g01-039/g01-039-06.png|export tax on the wool trade , collected by
lines/g01/g01-039/g01-039-07.png|means of that ' staple ' system which ensured that
lines/g01/g01-039/g01-039-08.png|prices , quality and tax could be efficiently su-
lines/g01/g01-039/g01-039-09.png|pervised and controlled , together with a
lines/g01/g01-043/g01-043-00.png|There were two other sources of public revenue -
lines/g01/g01-043/g01-043-01.png|first , the Church , which wisely followed the lead
lines/g01/g01-043/g01-043-02.png|of the Commons and in its own Convocations
lines/g01/g01-043/g01-043-04.png|the foreign merchants , with whom the King's
lines/g01/g01-043/g01-043-05.png|officials had formerly made private bargains
lines/g01/g01-043/g01-043-07.png|payments were now authorized by parliamentary
lines/g01/g01-043/g01-043-08.png|sanction at a rate roughly fifty per cent in
lines/g01/g01-043/g01-043-09.png|excess of the rate for native merchants .
lines/g01/g01-045/g01-045-00.png|In addition to these revenues , the King had the
lines/g01/g01-045/g01-045-01.png|financial benefits of his position at the head
lines/g01/g01-045/g01-045-02.png|of the feudal system , as its chief landowner
lines/g01/g01-045/g01-045-03.png|and the recipient of the fines of royal justice .
lines/g01/g01-045/g01-045-04.png|It was , therefore , a complicated and not very
lines/g01/g01-045/g01-045-05.png|satisfactory financial system in which the
lines/g01/g01-045/g01-045-06.png|borders between private and public purse were
lines/g01/g01-045/g01-045-08.png|and national war , and in which the comparati-
lines/g01/g01-045/g01-045-09.png|vely simple obligations of the feudal pyramid
lines/g01/g01-067/g01-067-00.png|But this time there was a very interesting
lines/g01/g01-067/g01-067-01.png|attempt to apply a sliding scale to the
lines/g01/g01-067/g01-067-02.png|payments demanded . The definition of an
lines/g01/g01-067/g01-067-03.png|adult was altered to read ' over sixteen ' ,
lines/g01/g01-067/g01-067-04.png|and , where the poorest were to pay a groat ,
lines/g01/g01-067/g01-067-05.png|the Duke of Lancaster and the Archbishops
lines/g01/g01-067/g01-067-06.png|of Canterbury and York were to pay ten marks ,
lines/g01/g01-067/g01-067-07.png|and between these two extremes a graduated
lines/g01/g01-067/g01-067-08.png|scale of payments was fixed for the
lines/g01/g01-067/g01-067-09.png|different classes of laymen and clerics .
lines/g01/g01-070/g01-070-00.png|Again the resentment was widespread and
lines/g01/g01-070/g01-070-01.png|the results disappointing - a tax estimated
lines/g01/g01-070/g01-070-02.png|to yield 50,000 in fact raised only 27,000 .
lines/g01/g01-070/g01-070-03.png|In the following year , 1380 , the last and
lines/g01/g01-070/g01-070-04.png|most notorious third poll-tax was agreed
lines/g01/g01-070/g01-070-05.png|by a Parliament which met at Northampton .
lines/g01/g01-070/g01-070-06.png|There were dark reasons for a meeting so
lines/g01/g01-070/g01-070-07.png|far away from the capital in a town with
lines/g01/g01-070/g01-070-08.png|poor communications and not over supplied
lines/g01/g01-070/g01-070-09.png|with hostelries and lodgings .
lines/g01/g01-074/g01-074-00.png|London was again in turmoil ; but this time
lines/g01/g01-074/g01-074-01.png|over a question of trade rivalry . A rich mer-
lines/g01/g01-074/g01-074-02.png|chant from Genoa had been murdered , and
lines/g01/g01-074/g01-074-03.png|John de Kyrkby , a Londoner , was one of
lines/g01/g01-074/g01-074-04.png|those charged with the crime . It is clear
lines/g01/g01-074/g01-074-05.png|from the chronicles that this was a sordid
lines/g01/g01-074/g01-074-06.png|quarrel between monopolists and interlopers .
lines/g01/g01-074/g01-074-07.png|The city merchants were jealous of foreign
lines/g01/g01-074/g01-074-08.png|merchants who could tempt court and
lines/g01/g01-074/g01-074-09.png|baronage with rarer luxuries than those
lines/g01/g01-083/g01-083-00.png|A sum of 160,000 was demanded - a staggering figure
lines/g01/g01-083/g01-083-01.png|to mediaeval eyes . It was determined that 100,000
lines/g01/g01-083/g01-083-02.png|was a fairer target , and the Parliament agreed to find
lines/g01/g01-083/g01-083-03.png|two-thirds of this sum providing the clergy supplied
lines/g01/g01-083/g01-083-04.png|the remainder . The method of assessment to which the
lines/g01/g01-083/g01-083-05.png|Commons agreed was that of the first poll-tax . The manifest
lines/g01/g01-083/g01-083-06.png|injustice of this method had been to a certain degree
lines/g01/g01-083/g01-083-07.png|corrected by the sliding scale of the second poll-tax ,
lines/g01/g01-083/g01-083-08.png|but this lesson was ignored , and the injustice trebled in
lines/g01/g01-083/g01-083-09.png|weight by a flat-rate tax at treble the rate - every adult
lines/g01/g01-088/g01-088-00.png|Trebling the rate was arrived at by a simple
lines/g01/g01-088/g01-088-04.png|The only concession made in view of the
lines/g01/g01-088/g01-088-05.png|objections to the first two poll-taxes was
lines/g01/g01-088/g01-088-06.png|the suggestion that the rich should help
lines/g01/g01-088/g01-088-07.png|the poor - but this was only a pious hope
lines/g01/g01-088/g01-088-08.png|because no machinery was provided for
lines/g01/g01-088/g01-088-09.png|carrying it into effect , and a subordinate
lines/g02/g02-059/g02-059-00.png|In Chapter Two he gauged the nature of the heart's movements
lines/g02/g02-059/g02-059-01.png|from the dissection of living animals , showing how these move-
lines/g02/g02-059/g02-059-02.png|ments alternate with rests and are seen best in cold animals
lines/g02/g02-059/g02-059-03.png|or in flagging warmer ones . At the time of its movement
lines/g02/g02-059/g02-059-04.png|the heart becomes generally constricted , its walls thicken ,
lines/g02/g02-059/g02-059-05.png|its ventricles decrease in volume and it expels its
lines/g02/g02-059/g02-059-06.png|content of blood , appearing paler in so doing in animals
lines/g02/g02-059/g02-059-07.png|such as serpents , frogs , and the like .
lines/g02/g02-062/g02-062-00.png|At one and the same time , therefore , occur the beat
lines/g02/g02-062/g02-062-01.png|of the apex , the thickening of the heart walls , and
lines/g02/g02-062/g02-062-02.png|the forcible expulsion of their contained blood by the
lines/g02/g02-062/g02-062-03.png|contraction of the ventricles . Going on in Chapter Three
lines/g02/g02-062/g02-062-04.png|to the movement of the arteries , likewise gauged from
lines/g02/g02-062/g02-062-05.png|the dissections of living animals , Harvey noted that
lines/g02/g02-062/g02-062-06.png|contraction of the heart and the apex beat occur in
lines/g02/g02-062/g02-062-07.png|systole , simultaneously with dilatation of the arteries
lines/g02/g02-062/g02-062-08.png|and of the artery-like vein , and expulsion of the
lines/g02/g02-062/g02-062-09.png|ventricular content .
lines/g02/g02-065/g02-065-00.png|Arterial pulsation disappears with cessation of
lines/g02/g02-065/g02-065-01.png|ventricular contraction . During cutting or puncture of
lines/g02/g02-065/g02-065-02.png|the ventricles , there is often forcible expulsion
lines/g02/g02-065/g02-065-03.png|of blood from the wound . Arterial diastole is
lines/g02/g02-065/g02-065-04.png|thus synchronous with cardiac systole but ,
lines/g02/g02-065/g02-065-05.png|when movement of blood through arteries is
lines/g02/g02-065/g02-065-06.png|hindered by compression , infarction or inter-
lines/g02/g02-065/g02-065-07.png|ception , the more distal arteries pulsate
lines/g02/g02-065/g02-065-09.png|than the impulse of the blood entering them .
lines/g02/g02-073/g02-073-00.png|' And while the heart is slowly dying ,
lines/g02/g02-073/g02-073-03.png|three auricular beats , produce a single
lines/g03/g03-000/g03-000-00.png|Sentence Database
lines/g03/g03-000/g03-000-01.png|Yet in spite of the fact that his ideas did his
lines/g03/g03-000/g03-000-02.png|business no good George would never conceal them .
lines/g03/g03-000/g03-000-06.png|George won many prizes , and though some people
lines/g03/g03-000/g03-000-08.png|would , and the comrades helped in many
lines/g03/g03-000/g03-000-09.png|ways .
lines/g03/g03-004/g03-004-00.png|When eventually the ovens were fixed at the new shop , the tremen-
lines/g03/g03-016/g03-016-01.png|Guardian in March of that year , 1,000,000
lines/g03/g03-016/g03-016-02.png|men were out a fortnight , disciplined and solid ,
lines/g03/g03-016/g03-016-03.png|when only 20 per cent of them stood to gain
lines/g03/g03-016/g03-016-04.png|anything from the strike and the other 80 per
lines/g03/g03-016/g03-016-05.png|cent made sacrifices for their fellow men ;
lines/g03/g03-016/g03-016-06.png|this remarkable strike raised the question of a
lines/g03/g03-016/g03-016-07.png|living wage and showed the worth of the
lines/g03/g03-032/g03-032-00.png|Soon they were good enough to sing at meetings .
lines/g03/g03-032/g03-032-01.png|One of the helpful by-products was that
lines/g03/g03-032/g03-032-02.png|they were able to obtain some respectable
lines/g03/g03-032/g03-032-04.png|and Red Flag badge , thus presenting a much
lines/g03/g03-032/g03-032-05.png|better appearance . Later , on many a sunny Sunday
lines/g03/g03-032/g03-032-06.png|evening , when George went to speak at Malin Bridge ,
lines/g03/g03-032/g03-032-07.png|they would be there to begin the meeting .
lines/g03/g03-040/g03-040-00.png|As they became known the Choir went to working-
lines/g03/g03-040/g03-040-04.png|day evenings to the Corner Pin Hotel , to rally
lines/g03/g03-040/g03-040-05.png|the members . The B.S.P. also rented pleasant rooms
lines/g03/g03-040/g03-040-06.png|on West Street , where a successful Sunday
lines/g03/g03-040/g03-040-07.png|school was held .
lines/g03/g03-043/g03-043-00.png|One of the students was young
lines/g03/g03-043/g03-043-01.png|George , and another the dark-haired
lines/g03/g03-043/g03-043-03.png|George often spoke at the Sunday school .
lines/g03/g03-043/g03-043-04.png|He christened the babies . Also , when
lines/g03/g03-043/g03-043-06.png|at funerals . Religion was one of his pet
lines/g03/g03-043/g03-043-07.png|subjects , for being well acquainted
lines/g03/g03-043/g03-043-08.png|with the Bible , which he had
lines/g03/g03-049/g03-049-00.png|Although his ideas were diametrically opposed
lines/g03/g03-049/g03-049-01.png|to those of parsons he got on wonderfully well
lines/g03/g03-049/g03-049-02.png|with them , particularly those who , like the Rev.
lines/g03/g03-049/g03-049-04.png|the Church Socialist League , genuinely advocated
lines/g03/g03-049/g03-049-05.png|socialism . With such men , who had the
lines/g03/g03-049/g03-049-06.png|courage of their convictions and their
lines/g03/g03-049/g03-049-07.png|Christianity , common ground could be found .
lines/g03/g03-052/g03-052-00.png|There was no abatement in political
lines/g03/g03-052/g03-052-01.png|work . The British Socialist Party endea-
lines/g03/g03-052/g03-052-03.png|Council , and to Parliament , being deter-
lines/g03/g03-052/g03-052-04.png|mined and obdurate in their attitude that
lines/g03/g03-052/g03-052-05.png|their candidate must go forward in the
lines/g03/g03-052/g03-052-06.png|elections . In the Sheffield Trades and Labour
lines/g03/g03-052/g03-052-07.png|Council meeting on October 16 , 1912 , George
lines/g03/g03-052/g03-052-08.png|had said , ' Mr. Barton would go to the poll .
lines/g03/g03-052/g03-052-09.png|Just as the Labour Party had fought the
lines/g03/g03-052/g03-052-10.png|Liberals , they were going to fight the Labour
lines/g03/g03-058/g03-058-00.png|This new party , the British Socialist Party , was
lines/g03/g03-058/g03-058-01.png|not prepared to accept the role of junior helper
lines/g03/g03-058/g03-058-03.png|propaganda in order to increase the volume of
lines/g03/g03-058/g03-058-04.png|socialist thought in the city , but sought to create
lines/g03/g03-058/g03-058-05.png|in the Labour movement a more militant attitude
lines/g03/g03-058/g03-058-06.png|capable of achieving socialism for the working
lines/g03/g03-058/g03-058-07.png|people .
lines/g03/g03-064/g03-064-00.png|Alf Barton , who in 1911 was presented
lines/g03/g03-064/g03-064-01.png|with a book on the life of Marx ,
lines/g03/g03-064/g03-064-02.png|and a gold purse in recognition of his
lines/g03/g03-064/g03-064-03.png|work for the movement , was later
lines/g03/g03-064/g03-064-05.png|cessary to understand Marxism in order to
lines/g03/g03-064/g03-064-07.png|he was a keen member of the B.S.P. .
lines/g04/g04-003/g04-003-01.png|a walk over the fields while we attended
lines/g04/g04-003/g04-003-02.png|to our business . To my amusement ,
lines/g04/g04-003/g04-003-03.png|when we met at tea at the rectory
lines/g04/g04-003/g04-003-04.png|after the Dedication , the Archbishop
lines/g04/g04-003/g04-003-05.png|said he had been stopped by
lines/g04/g04-003/g04-003-06.png|a farmer in a field . He seemed
lines/g04/g04-003/g04-003-07.png|rather indignant , but we took the
lines/g04/g04-003/g04-003-08.png|episode without a smile till afterwards .
lines/g04/g04-007/g04-007-00.png|The Hall proved most useful , especially in winter
