lines/j07/j07-015/j07-015-02.png|arrangement of a single passage . This can be
lines/j07/j07-015/j07-015-04.png|manufacturing equipment available . The corrugation
lines/j07/j07-015/j07-015-06.png|of uniformity in height and fin pitch .
lines/k01/k01-051/k01-051-00.png|Though that was not quite the phrase , for even
lines/k01/k01-051/k01-051-01.png|if he could succeed Sir Charles he would , as
lines/k01/k01-051/k01-051-02.png|an executive , be eternally differentiated from
lines/k01/k01-051/k01-051-03.png|the Governors . Fairbanks managed the Governors
lines/k01/k01-051/k01-051-04.png|beautifully , he knew more than they , he was
lines/k01/k01-051/k01-051-05.png|cleverer than most , discreetly used their Christian
lines/k01/k01-051/k01-051-06.png|names - but remained their servant . They had
lines/k01/k01-051/k01-051-07.png|no office hours , however elastic ; their lives were
lines/k01/k01-051/k01-051-08.png|spent in committee making decisions for others
lines/k01/k01-051/k01-051-09.png|to execute on the basis of data laboriously
lines/k02/k02-018/k02-018-00.png|The gin pahits , and now the beer with the
lines/k02/k02-018/k02-018-01.png|curry , had their desired effect on us ;
lines/k02/k02-018/k02-018-02.png|or rather , on Nigel and myself . Lee , I
lines/k02/k02-018/k02-018-03.png|noticed , had asked for Coca-Cola . This
lines/k02/k02-018/k02-018-04.png|rather surprised me from a young man
lines/k02/k02-018/k02-018-05.png|who was otherwise so sophisticated . He
lines/k02/k02-018/k02-018-06.png|was not , however , ostentatious about
lines/k02/k02-018/k02-018-07.png|the matter .
lines/k02/k02-023/k02-023-00.png|If anything , he had merely become a little more reserved , and
lines/k02/k02-023/k02-023-01.png|much more polite . I thought to myself : ' A few years in the
lines/k02/k02-023/k02-023-02.png|East , my boy , and you 'll drink - I 've seen your kind be-
lines/k02/k02-023/k02-023-03.png|fore ! ' After the curry , I wanted only to go upstairs to
lines/k02/k02-023/k02-023-04.png|bed . I had long since become accustomed , and now addicted ,
lines/k02/k02-023/k02-023-05.png|to an after-curry nap .
lines/k02/k02-029/k02-029-00.png|Lee , however , showed not the slightest sign of fatigue . ' I
lines/k02/k02-029/k02-029-01.png|wonder if you 'd mind if I took a bit of a look round , '
lines/k02/k02-029/k02-029-03.png|I must say , was very good about it . I knew how much
lines/k02/k02-029/k02-029-04.png|he probably wanted to sleep himself . But , almost
lines/k02/k02-029/k02-029-05.png|gallantly , he said :
lines/k02/k02-036/k02-036-01.png|young Lee protested , considerate as always .
lines/k02/k02-036/k02-036-02.png|' That 's not necessary if you want to rest , sir .
lines/k02/k02-036/k02-036-03.png|I 'm sure I won't do any harm . ' Nigel
lines/k02/k02-036/k02-036-04.png|laughed . I had not known he was so
lines/k02/k02-036/k02-036-05.png|good-natured . But then , I suppose I had
lines/k02/k02-036/k02-036-06.png|never given him similar cause to display
lines/k02/k02-053/k02-053-00.png|I slept soundly , and much later than I should . It
lines/k02/k02-053/k02-053-03.png|Downstairs I could hear the murmur of voices ,
lines/k02/k02-053/k02-053-04.png|and knew they were back . I wondered , as I
lines/k02/k02-053/k02-053-05.png|wrapped a 6sarong around my waist , if
lines/k02/k02-053/k02-053-06.png|Nigel at all resented being deprived of his
lines/k02/k02-053/k02-053-07.png|afternoon sleep .
lines/k02/k02-062/k02-062-00.png|And I said to myself : Oh , God , doesn't the
lines/k02/k02-062/k02-062-01.png|boy ever relax ! He turned his gaze away
lines/k02/k02-062/k02-062-02.png|from me almost instantly , but it had
lines/k02/k02-062/k02-062-03.png|been enough to make me conscious of the
lines/k02/k02-062/k02-062-06.png|probably thought my appearance quite a breach
lines/k02/k02-062/k02-062-07.png|of the social graces ; but , naturally , he said
lines/k02/k02-062/k02-062-08.png|not so much as a word about it .
lines/k02/k02-067/k02-067-00.png|' We 've just had tea , ' Nigel said . ' Would you like
lines/k02/k02-067/k02-067-01.png|the cookie to make you a fresh lot ? ' ' I 'd rather
lines/k02/k02-067/k02-067-02.png|have whisky , ' I told him . ' Thought as much .
lines/k02/k02-067/k02-067-04.png|Wouldn't mind a stengah myself . How about
lines/k02/k02-067/k02-067-05.png|you , Harry ? ' So they had managed to come
lines/k02/k02-067/k02-067-06.png|to the stage of using each other's Christian
lines/k02/k02-067/k02-067-07.png|names , I noted .
lines/k02/k02-076/k02-076-00.png|Perhaps Lee wasn't quite as
lines/k02/k02-076/k02-076-01.png|reserved as I thought . ' Thanks ,
lines/k02/k02-076/k02-076-03.png|Although I 'd like to have
lines/k02/k02-076/k02-076-04.png|whatever you have . I want to
lines/k02/k02-076/k02-076-05.png|get to know the kind of life
lines/k02/k02-076/k02-076-06.png|people lead in the East , you know . '
lines/k02/k02-076/k02-076-07.png|At this , I felt a return of the
lines/k02/k02-076/k02-076-08.png|irritation I felt with him
lines/k02/k02-093/k02-093-00.png|Knowing Nigel , I would have been surprised if he
lines/k02/k02-093/k02-093-01.png|had not made his usual ' arrangements ' . A bachelor
lines/k02/k02-093/k02-093-02.png|himself , he knew well how to entertain his bachelor
lines/k02/k02-093/k02-093-03.png|friends . He caught my look and pursed his lips in
lines/k02/k02-093/k02-093-04.png|a quick little grimace of acknowledgement ; then raised
lines/k02/k02-093/k02-093-05.png|an enquiring eyebrow in young Lee's direction .
lines/k02/k02-097/k02-097-00.png|I shrugged a shoulder . Lee would have
lines/k02/k02-097/k02-097-01.png|to decide about that for himself , I
lines/k02/k02-097/k02-097-02.png|thought , and noticed that although he
lines/k02/k02-097/k02-097-03.png|was looking at the other girl , he did
lines/k02/k02-097/k02-097-04.png|so quite dispassionately , almost as though
lines/k02/k02-097/k02-097-05.png|he was merely interested in the unfamiliar
lines/k02/k02-097/k02-097-06.png|clothes she was wearing . And I thought
lines/k02/k02-097/k02-097-07.png|to myself : He may be still too much of
lines/k02/k02-097/k02-097-08.png|a ' new chum ' to see ' the beauty of
lines/k02/k02-097/k02-097-09.png|the East ' .
lines/k02/k02-102/k02-102-00.png|There was still an ease in our conversation , but its
lines/k02/k02-102/k02-102-01.png|scope was restricted . I felt that I could hardly make the
lines/k02/k02-102/k02-102-02.png|usual enquiries and comments about Nigel's various mistresses
lines/k02/k02-102/k02-102-04.png|wondered which of his girls was in favour at the moment .
lines/k02/k02-102/k02-102-05.png|And I suppose he felt the same . We had only a few drinks ,
lines/k02/k02-102/k02-102-06.png|then decided to bathe and dress for a rather early
lines/k02/k02-102/k02-102-07.png|dinner .
lines/k02/k02-112/k02-112-00.png|He had one of the better Kashmir carpets on
lines/k02/k02-112/k02-112-01.png|the floor . His pictures and curtains , indeed I
lines/k02/k02-112/k02-112-02.png|suppose the entire furnishings , had been se-
lines/k02/k02-112/k02-112-03.png|lected personally . The house was , as he
lines/k02/k02-112/k02-112-04.png|occasionally proclaimed , his home - and he had
lines/k02/k02-112/k02-112-05.png|made it as such . I doubt if he will ever
lines/k02/k02-112/k02-112-06.png|leave Malaya , even when he retires .
lines/k02/k02-117/k02-117-00.png|The country , and his mistresses , have come
lines/k02/k02-117/k02-117-01.png|to mean too much to him . And , indirectly ,
lines/k02/k02-117/k02-117-05.png|I used the excuse of our early start in the
lines/k02/k02-117/k02-117-06.png|morning to retire as soon as it seemed
lines/k02/k02-117/k02-117-09.png|awaiting me .
lines/k03/k03-117/k03-117-00.png|After lunch two of the Prime Minister's
lines/k03/k03-117/k03-117-01.png|grandchildren who had sat , rather intimidated
lines/k03/k03-117/k03-117-02.png|by Ormston and staring at the Grinling
lines/k03/k03-117/k03-117-03.png|Gibbons carving around the fireplace , rose
lines/k03/k03-117/k03-117-04.png|gratefully from the table , leaving the two
lines/k03/k03-117/k03-117-05.png|men together . A nurse came in , and asked
lines/k03/k03-117/k03-117-06.png|the Prime Minister if he wanted to be
lines/k03/k03-117/k03-117-07.png|helped out on to the lawn , but he waved
lines/k03/k03-117/k03-117-08.png|her away impatiently .
lines/k03/k03-138/k03-138-00.png|I don't mean just our direct military costs . I 'm
lines/k03/k03-138/k03-138-01.png|thinking of the African Boycott which is already working up .
lines/k03/k03-138/k03-138-02.png|I 'm afraid , Prime Minister , you 're not going to like the
lines/k03/k03-138/k03-138-04.png|Prime Minister commented wearily . The Chancellor
lines/k03/k03-138/k03-138-05.png|was repeating an argument which he had already
lines/k03/k03-138/k03-138-06.png|developed for an hour before lunch .
lines/k03/k03-144/k03-144-00.png|' It comes at a bad time , ' said
lines/k03/k03-144/k03-144-01.png|Ormston . ' A singularly bad time . The
lines/k03/k03-144/k03-144-03.png|is a sign of life - very encouraging ! '
lines/k03/k03-144/k03-144-04.png|' The younger men - ' ' Which ones ? '
lines/k03/k03-144/k03-144-06.png|Hadley , Prebble , Lambert-Price - the
lines/k03/k03-144/k03-144-07.png|New Africa lot - ' ' Do they confide
lines/k03/k03-152/k03-152-00.png|' Only at yesterday's meeting - they 're very restless , Prime
lines/k03/k03-152/k03-152-02.png|down mobs of natives . They 're very much afraid that
lines/k03/k03-152/k03-152-03.png|if the Opposition get a Commission of Enquiry some
lines/k03/k03-152/k03-152-04.png|rather dismal stuff is going to come out . '
lines/k03/k03-152/k03-152-05.png|' Young back-benchers are always restive when they 're
lines/k03/k03-152/k03-152-07.png|time since his grandchildren left the table , he smiled .
lines/k03/k03-157/k03-157-00.png|' Why don't you give them something to play with ? '
lines/k03/k03-157/k03-157-01.png|' They 've found their own toy , ' said Ormston ,
lines/k03/k03-157/k03-157-03.png|The Prime Minister continued in his flippant
lines/k03/k03-157/k03-157-04.png|tone , ' Tell the Chief to give them a
lines/k03/k03-164/k03-164-01.png|They feel pretty strongly about Africa . They are greatly
lines/k03/k03-164/k03-164-04.png|On the whole , the country is still in favour
lines/k03/k03-164/k03-164-05.png|of moderation and common sense . Melville has
lines/k03/k03-164/k03-164-07.png|- extravagant - nineteenth centuryish -
lines/k03/k03-164/k03-164-08.png|almost cranky . '
lines/k03/k03-180/k03-180-02.png|quite that . The whole business blew up from Melville's disgraceful
lines/k03/k03-180/k03-180-03.png|indiscretion to Julia Drayford in Mrs. M'landa's presence .
lines/k03/k03-180/k03-180-05.png|what .
lines/k04/k04-000/k04-000-00.png|As he turned aside his head , since he could not
lines/k04/k04-000/k04-000-01.png|bear to look at her beautiful , pleading face , he was
lines/k04/k04-000/k04-000-02.png|suddenly attacked by suspicion . ' You wish to marry
lines/k04/k04-000/k04-000-04.png|jealousy . She sighed deeply , and looked away . ' Do you ?
lines/k04/k04-005/k04-005-03.png|he could collect his wits to reply to this , there was a bustle
lines/k04/k04-005/k04-005-04.png|and confusion at the end of the room . Prince Doria had
lines/k04/k04-005/k04-005-05.png|wearied of his toy and was packing it away in its painted
lines/k04/k04-005/k04-005-06.png|coffer .
lines/k04/k04-010/k04-010-00.png|The party was now preparing to see
lines/k04/k04-010/k04-010-01.png|the tapestries , and in the general
lines/k04/k04-010/k04-010-02.png|movement , Vittoria was separated from
lines/k04/k04-010/k04-010-03.png|Orsini . Although neither of them
lines/k04/k04-010/k04-010-04.png|wished to follow the sightseers , there seemed
lines/k04/k04-010/k04-010-05.png|no alternative . As she was about to mount
lines/k04/k04-010/k04-010-06.png|a wide and shallow flight of marble
lines/k04/k04-010/k04-010-07.png|stairs , she became aware of someone
lines/k04/k04-010/k04-010-08.png|watching her intently , and turning
lines/k04/k04-010/k04-010-09.png|in that direction , she saw Olimpia ,
lines/k04/k04-014/k04-014-00.png|The young man was bending over her with the
lines/k04/k04-014/k04-014-01.png|assiduity of a lover , but the girl appeared to be more
lines/k04/k04-014/k04-014-03.png|through half-closed eyes . This was a slight shock to
lines/k04/k04-014/k04-014-06.png|young man's presence at the palazzo .
lines/k04/k04-017/k04-017-00.png|' Are you enjoying yourself , Olimpia ? ' she
lines/k04/k04-017/k04-017-02.png|her fan , in passing ; but she did not wait for
lines/k04/k04-017/k04-017-03.png|the answer . Disturbed by vague uneasiness , she
lines/k04/k04-017/k04-017-04.png|was wondering whether Olimpia had been
lines/k04/k04-017/k04-017-05.png|watching her talk with Orsini . Surely she
lines/k04/k04-017/k04-017-06.png|could not have overheard anything they
lines/k04/k04-017/k04-017-08.png|on that point , for she was certain no one
lines/k04/k04-017/k04-017-09.png|had been standing near them .
lines/k04/k04-022/k04-022-01.png|put Vittoria on guard . ' Santa Maria ! These spying
lines/k04/k04-022/k04-022-02.png|eyes ! ' she thought , bitterly . Doria was continually
lines/k04/k04-022/k04-022-04.png|objects of beauty or interest . Vittoria , on the
lines/k04/k04-022/k04-022-06.png|information , which held no interest for her :
lines/k04/k04-022/k04-022-07.png|' ... now this sapphire ...
lines/k04/k04-028/k04-028-01.png|hair of the Empress Messalina , as she crouched
lines/k04/k04-028/k04-028-04.png|Farnese , with a snigger . ' The old cuckold
lines/k04/k04-028/k04-028-05.png|Claudius had the last word , after all . He
lines/k04/k04-028/k04-028-06.png|knew how to deal with an adulterous wife ,
lines/k04/k04-028/k04-028-07.png|eh , Orsini ? '
lines/k04/k04-033/k04-033-01.png|not hear it . Now they entered the long gallery
lines/k04/k04-033/k04-033-02.png|where they dispersed and wandered around , admiring
lines/k04/k04-033/k04-033-03.png|and commenting on the glowing hues and barbaric
lines/k04/k04-033/k04-033-04.png|splendours of the tapestries Doria had brought
lines/k04/k04-033/k04-033-05.png|back from Lepanto . After a short interval , Orsini
lines/k04/k04-033/k04-033-06.png|found an opportunity to rejoin Vittoria .
lines/k04/k04-033/k04-033-07.png|' We must talk further , ' he said in a low
lines/k04/k04-033/k04-033-08.png|urgent voice . ' Where ? '
lines/k04/k04-039/k04-039-01.png|' Olimpia is watching us . The young man with her is
lines/k04/k04-039/k04-039-02.png|Orlando Cavalcanti , Francesco's friend . ' Orsini
lines/k04/k04-039/k04-039-03.png|shot an impatient glance at the couple . ' The young man
lines/k04/k04-039/k04-039-05.png|looking at us . Now I must know , ' he whispered , ' what
lines/k04/k04-039/k04-039-06.png|you meant , cara mia . Do you want your freedom in order
lines/k04/k04-039/k04-039-07.png|to marry ? '
lines/k04/k04-050/k04-050-02.png|had to bend his head to hear : ' I will never be
lines/k04/k04-050/k04-050-03.png|any man's mistress . As to marrying again ...
lines/k04/k04-050/k04-050-04.png|if I were free ... there is only one man I would
lines/k04/k04-050/k04-050-05.png|wish to marry ... but ... he , like myself , is now
lines/k04/k04-050/k04-050-06.png|bound . '
lines/k04/k04-054/k04-054-00.png|With a swift gesture she closed her fan
lines/k04/k04-054/k04-054-01.png|and moved away from him towards the group
lines/k04/k04-054/k04-054-02.png|in the centre of the gallery , leaving him standing
lines/k04/k04-054/k04-054-03.png|alone , against that glowing , barbaric background ,
lines/k04/k04-054/k04-054-04.png|with a deeply thoughtful expression on his face .
lines/k04/k04-054/k04-054-05.png|On a bright unclouded morning a few days after
lines/k04/k04-054/k04-054-07.png|coach left the villa , lurched over the unpaved
lines/k04/k04-054/k04-054-08.png|track and turned towards the ruined Baths
lines/k04/k04-054/k04-054-09.png|of Diocletian .
lines/k04/k04-057/k04-057-00.png|Vittoria , accompanied by her maid , Lucia , was on her
lines/k04/k04-057/k04-057-04.png|debts . Lucia was thinking how beautiful her mistress
lines/k04/k04-057/k04-057-06.png|with its underskirt of rose-brocade fitted her
lines/k04/k04-061/k04-061-00.png|The sparkling society of the Doria Palace , the flattery
lines/k04/k04-061/k04-061-02.png|restless spirit , all threw into sharp relief the contrast
lines/k04/k04-061/k04-061-03.png|of her grey life with the splendid one that filled
lines/k04/k04-061/k04-061-06.png|to give her a separate establishment , he invariably
lines/k04/k04-061/k04-061-07.png|pleaded his financial dependence on his uncle , who
lines/k04/k04-064/k04-064-00.png|He reminded her that they must abide by Roman
lines/k04/k04-064/k04-064-01.png|custom , and dwell there with their relations . Her
lines/k04/k04-064/k04-064-02.png|values were those of the materialist who assesses
lines/k04/k04-064/k04-064-03.png|every human being in terms of fame , power and
lines/k04/k04-064/k04-064-04.png|wealth . Francesco she despised for his dullness , his
lines/k04/k04-064/k04-064-05.png|lack of initiative , his subservience to his uncle .
lines/k04/k04-068/k04-068-00.png|Her husband's gentleness and amiability , his unselfish
lines/k04/k04-068/k04-068-01.png|love for her , she regarded as signs of weakness . He was a
lines/k04/k04-068/k04-068-02.png|futile creature who had not even proved capable of giving
lines/k04/k04-068/k04-068-03.png|her a child . Whatever passion she had experienced in the
lines/k04/k04-068/k04-068-04.png|first months of marriage had been ousted by contempt .
lines/k04/k04-068/k04-068-05.png|She had never loved him . Her thoughts rushed to Orsini .
lines/k04/k04-068/k04-068-06.png|Since the meeting in the Doria Palace , no word had
lines/k04/k04-068/k04-068-07.png|come from him , and this silence oppressed her spirits
lines/k04/k04-068/k04-068-08.png|with a weight of misgiving .
lines/k04/k04-075/k04-075-00.png|She had , perhaps , demanded too much . The
lines/k04/k04-075/k04-075-01.png|kiss in the garden had plumbed unsus-
lines/k04/k04-075/k04-075-02.png|pected depths in her , and she knew that
lines/k04/k04-075/k04-075-04.png|indeed , match his . Every instinct urged her to
lines/k04/k04-075/k04-075-06.png|to which her own had responded as it
lines/k04/k04-075/k04-075-07.png|had responded to no other human being .
lines/k04/k04-079/k04-079-00.png|Prudence , ambition and reason had
lines/k04/k04-079/k04-079-01.png|held instinct in check , and they must
lines/k04/k04-079/k04-079-03.png|compromise . For a brief interval
lines/k04/k04-079/k04-079-04.png|she allowed herself the luxury of
lines/k04/k04-079/k04-079-05.png|dreams . She began to imagine life at
lines/k04/k04-079/k04-079-07.png|conversation of poets and dilettanti . She
lines/k04/k04-079/k04-079-09.png|ment , and herself on the ducal dais beside
lines/k04/k04-079/k04-079-10.png|Orsini , placing a chaplet of roses on the brows
lines/k04/k04-085/k04-085-00.png|This reverie was rudely ended as the coach gave a
lines/k04/k04-085/k04-085-02.png|the two girls from their seats . Lucia uttered a cry of
lines/k04/k04-085/k04-085-03.png|alarm . ' Look , madonna , we are surrounded ! ' It was true .
lines/k04/k04-085/k04-085-04.png|Men armed with pikes and daggers swarmed about
lines/k04/k04-085/k04-085-07.png|shrieked Lucia . ' Banditti ! '
lines/k04/k04-093/k04-093-00.png|Vittoria now realized that they were outside
lines/k04/k04-093/k04-093-02.png|crouching in the doorway of the church and exhibiting
lines/k04/k04-093/k04-093-04.png|Lucia , ' said Vittoria , pointing to the badge on the man's
lines/k04/k04-093/k04-093-06.png|stared speechlessly at the golden bear ; Vittoria swiftly
lines/k04/k04-093/k04-093-07.png|averted her head to avoid the impertinent glance
lines/k04/k04-099/k04-099-00.png|Her thoughts at this moment were chaotic . The
lines/k04/k04-099/k04-099-01.png|coach now turned in another direction , towards
lines/k04/k04-099/k04-099-02.png|the wild and desolate region behind the baths .
lines/k04/k04-099/k04-099-03.png|It was sparsely inhabited , dotted with fallow fields
lines/k04/k04-099/k04-099-04.png|and terraced vineyards , and here and there jutted
lines/k04/k04-099/k04-099-05.png|a brown outcrop of flower-wreathed ruins , a pathetic
lines/k04/k04-099/k04-099-06.png|reminder of Rome's former greatness .
lines/k04/k04-103/k04-103-00.png|In this region of Monti most of the public baths
lines/k04/k04-103/k04-103-01.png|had been built in the time of the Caesars , but with the
lines/k04/k04-103/k04-103-02.png|breaking of the aqueducts during the barbarian invasions
lines/k04/k04-103/k04-103-03.png|the baths had lost their purpose ; they had become
lines/k04/k04-103/k04-103-06.png|used these quarries as hiding places , to the danger
lines/k04/k04-103/k04-103-07.png|of travellers in the district .
lines/k04/k04-106/k04-106-00.png|As they lumbered past at a rattling pace , Vittoria
lines/k04/k04-106/k04-106-01.png|could see a wisp of smoke curling above the fire of a
lines/k04/k04-106/k04-106-02.png|gypsy encampment and a few tatterdemalion creatures
lines/k04/k04-106/k04-106-03.png|gathered about it , cooking their frugal meal . These
lines/k04/k04-106/k04-106-04.png|were left far behind . An old man belabouring an
lines/k04/k04-110/k04-110-01.png|Lucia might have been the only living
lines/k04/k04-110/k04-110-02.png|creatures on an empty planet . After the
lines/k04/k04-110/k04-110-03.png|initial shock , Vittoria felt calm . She
lines/k04/k04-110/k04-110-04.png|knew exactly what she wanted , and
lines/k04/k04-110/k04-110-05.png|was prepared to take it without scruple ,
lines/k04/k04-110/k04-110-06.png|if she could . What she had forgotten
lines/k04/k04-110/k04-110-07.png|in her self-absorption in her own schemes
lines/k04/k04-110/k04-110-08.png|was that other people were equally absorbed
lines/k04/k04-110/k04-110-09.png|in their schemes , which were likely to
lines/k04/k04-115/k04-115-00.png|This move today was a reminder of that fact .
lines/k04/k04-115/k04-115-01.png|Whilst she automatically patted the hand of
lines/k04/k04-115/k04-115-02.png|the agitated Lucia , her brain was working
lines/k04/k04-115/k04-115-03.png|rapidly , and she decided that she must be
lines/k04/k04-115/k04-115-05.png|difficult though that would be . She became
lines/k04/k04-115/k04-115-06.png|aware that the pace was slackening ;
lines/k04/k04-119/k04-119-00.png|The moment had come . Upon the ensuing interview
lines/k04/k04-119/k04-119-02.png|her heart was beating fast , and the palms of her
lines/k04/k04-119/k04-119-03.png|hands were damp . Orsini's high-crowned hat with
lines/k04/k04-119/k04-119-04.png|its jaunty plume blotted out the light ; his hand
lines/k04/k04-126/k04-126-01.png|language : ' Yes . But make it worth her while . '
lines/k04/k04-126/k04-126-02.png|' I see . I know how to deal with people like that , '
lines/k04/k04-126/k04-126-03.png|and turning to the cowering Lucia , he spoke in her
lines/k04/k04-136/k04-136-00.png|Lucia was regarding him as a rabbit looks at a stoat .
lines/k04/k04-136/k04-136-01.png|Thrusting his head farther into the coach , he said
lines/k04/k04-136/k04-136-02.png|sombrely : ' Have you ever heard of a punishment called
lines/k04/k04-136/k04-136-08.png|heard of it ?
lines/k04/k04-142/k04-142-00.png|The Orsini give that to traitors . There is
lines/k04/k04-142/k04-142-01.png|no escaping the vengeance of an Orsini . We hunt
lines/k04/k04-142/k04-142-02.png|a traitor down to the ends of the earth , and no
lines/k04/k04-142/k04-142-03.png|power can save him ... or her . Do you understand ? '
lines/k04/k04-142/k04-142-05.png|continued , giving her a keen look , ' the Orsini are
lines/k04/k04-142/k04-142-06.png|generous to those who serve them faithfully .
lines/k04/k04-149/k04-149-01.png|speech . He turned to Vittoria , sitting erect ,
lines/k04/k04-149/k04-149-02.png|with flushed cheeks and eyes sparkling with
lines/k04/k04-156/k04-156-05.png|be so good as to order your men not to molest my
lines/k04/k04-163/k04-163-01.png|nevertheless , to the man who had peered into the
lines/k04/k04-163/k04-163-02.png|coach , whom he had addressed as Luigi , and gave him sharp
lines/k04/k04-163/k04-163-03.png|instructions on the matter . Vittoria stood looking about her ,
lines/k04/k04-163/k04-163-04.png|breathing the scent of thyme . The land at her feet sloped
lines/k04/k04-163/k04-163-05.png|away into a tiny valley beyond which , on the crest
lines/k04/k04-163/k04-163-06.png|of a wooded hill-side , the ruins of a small temple
lines/k04/k04-163/k04-163-07.png|were etched against the clear blue of the sky .
lines/k07/k07-059a/k07-059a-00.png|He forgot time and place . He , the master , was gently
lines/k07/k07-059a/k07-059a-01.png|led along erotic paths which he knew existed , but
lines/k07/k07-059a/k07-059a-02.png|had never trodden . He learned how to use his
lines/k07/k07-059a/k07-059a-03.png|hands , how to adore that body without haste , how
lines/k07/k07-059a/k07-059a-04.png|to caress every inch with his mouth as well , to
lines/k07/k07-059a/k07-059a-05.png|creep down along her smooth muscles till he lost
lines/k07/k07-059a/k07-059a-06.png|himself in a rapture of kisses in places he 'd
lines/k07/k07-059a/k07-059a-07.png|dreamed of , where life began to ooze and quickened
lines/k07/k07-059a/k07-059a-08.png|his heart beat to a thunder .
lines/k07/k07-063a/k07-063a-00.png|He looked at her . Head thrown back in a pool of hair ,
lines/k07/k07-063a/k07-063a-01.png|her blood-red lips parted and the beating of her
lines/k07/k07-063a/k07-063a-02.png|heart in the full throat . Her mouth did things he
lines/k07/k07-063a/k07-063a-03.png|thought no human being could stand without
lines/k07/k07-063a/k07-063a-04.png|dying , but he went on living in an ocean of
lines/k07/k07-063a/k07-063a-05.png|voluptuousness , that swelled and ebbed over him ,
